{
  "schema": "action_receipt/v0.2",
  "proposal_id": "proposal-demo",
  "executed_at_ns": 2000000,
  "after_frame": {
    "schema": "frame_ref/v0.2",
    "surface_id": "surface-demo",
    "generation": 1,
    "tick": 8,
    "ts_ns": 2000000,
    "width": 800,
    "height": 600,
    "format": "rgb24",
    "ramws_path": "/dev/shm/ramws/demo.rgb",
    "sha256": "1111111111111111111111111111111111111111111111111111111111111111",
    "capture_us": 120
  },
  "verified": true,
  "verification": {
    "method": "pixel",
    "detail": "Expected region changed on next captured frame"
  },
  "error": ""
}
